{
  "schema_version":"asi_stack.p7_1c_reader_prose_quality_packet.v1","chapter_id":"safety-cases-and-structured-assurance","chapter_file":"chapters/safety-cases-and-structured-assurance.qmd","chapter_sha256":"ca80519a5d7aa8ec9eb269ddd4fab233cea73a1122de86292805a4403b430ef4","chapter_role":"load-bearing-reference","reader_spine_unit":"unit-19-readiness-and-liveness","review_state":"digest_bound_editorial_pass",
  "concrete_scene":{"heading":"Worked trace: a stale control result and an unresolved defeater","actor_or_system":"A safety case for model M7, a stale monitor result for M6, tool profile T-readonly, hazard H-exfiltration, an adapter countercase, and a readiness owner","attempted_action":"Advance an affected release path using stale evidence and an unresolved defeater.","observable_outcome":"Stale evidence routes to repair, the unresolved countercase routes to accountable review, and the compiled case can reach at most readiness review.","failed_or_tested_boundary":"The scene tests whether a complete graph, passing replacement score, or reviewer resolution creates safety or release authority; none does.","residual_owner":"Hazard, evidence, assumption, countercase, reviewer, safeguard, readiness, authority, release, and residual owners retain separate decisions.","evidence_boundary":"The trace compiles bounded references and routes; it does not establish hazard completeness, evidence adequacy, control effectiveness, risk, safety, or release authority."},
  "worked_trace":{"heading":"Worked trace: a stale control result and an unresolved defeater","state_labels":["case_syntactically_complete","m6_evidence_stale_for_m7","defeater_unresolved","evidence_repair_and_review","readiness_only"],"source_or_fixture_refs":["chapters/safety-cases-and-structured-assurance.qmd","evidence_quality/proof_model_dossiers/safety-cases-and-structured-assurance.md"],"maximum_inference":"Staleness and defeater routes are explicit for the authored case; hazard completeness, evidence adequacy, reviewer independence, control effectiveness, safety, and release remain unproven."},
  "counterexample_or_simpler_baseline":"The connected-graph baseline treats compilation as acceptance. The assurance packet separates compilation, challenge, review, and decision.","readable_claim":"A safety case is a structured argument and challenge surface, not a certificate that the system is safe or permission to deploy it.","normative_rule":"Bind each claim to exact deployment context, evidence version, assumptions, countercases, defeaters, safeguards, thresholds, reviewers, and residual owners. Stale evidence or an unresolved defeater blocks only the affected route and can advance at most to readiness review, never directly to release.",
  "formal_binding":{"claim_id":"safety-cases-and-structured-assurance.core","support_state":"argument","anchor":"Assurance Argument Compilation Packet"},"claim_atom_and_source_links":["safety-cases-and-structured-assurance.core","ext_gsn_community_standard_2021","ext_ul_4600_2023"],"caveat_consolidation":{"local_caveat":"The worked trace already distinguishes process routing from a safety conclusion.","consolidated_disposition":"Hazards, evidence, argument, reviewers, controls, risk, safety, readiness, authority, release, support, and transfer remain distinct.","distinct_limitations_preserved":true},"bookkeeping_surface_disposition":"M7, M6, tool, hazard, evidence, and defeater identities remain because stale binding is the argument; full case schemas stay formal.","semantic_diff":{"unique_claims_preserved":true,"sources_preserved":true,"proof_boundaries_preserved":true,"non_claims_preserved":true,"support_state_effect":"none","release_effect":"none"},"editorial_diagnostics":{"mega_sentence_disposition":"The short reader claim distinguishes argument from certificate.","hedge_disposition":"The existing trace preserves distinct limitations without repeated apology.","table_disposition":"The five-step case table remains because it shows route-specific consequences."},"non_claims":["The case does not establish system safety.","Compilation or review does not grant release authority.","The editorial revision does not move support or release state."]
}
