{
  "schema_version": "asi_stack.p7_1c_reader_prose_quality_packet.v1",
  "chapter_id": "governed-operations-incident-command-and-graceful-degradation",
  "chapter_file": "chapters/governed-operations-incident-command-and-graceful-degradation.qmd",
  "chapter_sha256": "fc377bdceeadb27057e42d5c52313b4801b9434ee2b41b2709c67df6cf92e51f",
  "chapter_role": "implementation-case",
  "reader_spine_unit": "unit-16-runtime-and-operations",
  "review_state": "digest_bound_editorial_pass",
  "concrete_scene": {
    "heading": "Natural publication-service development observation",
    "actor_or_system": "The ASI Stack repository, GitHub Actions build and deployment workflows, a commit-bound tested artifact, and a post-deploy crawler",
    "attempted_action": "Move maintained-book commit 5575d3cb through validation, proof, render, artifact custody, no-rebuild deployment, and separate-process public graph observation.",
    "observable_outcome": "The tested artifact reached GitHub Pages without rebuild; public deployment status arrived after 873 seconds and the post-deploy monitor completed after 893 seconds.",
    "failed_or_tested_boundary": "The trace tests source-to-artifact-to-public identity and observation, while explicitly leaving fault, rollback, compensation, unsafe-release, false-blocking, user quality, delayed harm, and independent reproduction untested.",
    "residual_owner": "The book's publication operator retains artifact expiry, moving-service state, monitor dependence, unmeasured operator and compute cost, and every unexercised incident path.",
    "evidence_boundary": "The route was formalized after success and is therefore a retrospective development observation, not a prospective held-out campaign, causal governed-operations result, or independent external reproduction."
  },
  "worked_trace": {
    "heading": "Natural publication-service development observation",
    "state_labels": ["source_commit", "tested_artifact", "no_rebuild_deploy", "public_effect", "post_deploy_observation"],
    "source_or_fixture_refs": ["experiments/p5_natural_publication_service_trace/results/2026-07-27-development.json", "docs/p5_natural_publication_service_development_trace.md"],
    "maximum_inference": "The retrospective trace establishes custody and observed publication for one named commit and interval; it establishes no incident-control efficacy, safe degradation, effect-complete rollback, unsafe-release rate, causal comparison, or production AI-service safety."
  },
  "counterexample_or_simpler_baseline": "The simpler baseline treats green source tests as proof of the live service. The trace requires the tested artifact to remain identical through deployment and then observes the public graph as a separate effect surface.",
  "readable_claim": "Restarting a service is not recovering governed operation. Recovery must reconnect the exact source, tested artifact, deployed state, authority, effects, residuals, and post-restoration observation.",
  "normative_rule": "When the live envelope is uncertain, narrow authority before changing the story. Every incident signal receives a disposition, every emergency lease expires, every degraded route preserves non-negotiable constraints, and restoration waits for state-and-effect reconciliation plus an independent-enough observation.",
  "formal_binding": {"claim_id": "governed-operations-incident-command-and-graceful-degradation.core", "support_state": "argument", "anchor": "closed incident lifecycle that binds detection, classification, command authority"},
  "claim_atom_and_source_links": ["governed-operations-incident-command-and-graceful-degradation.core", "ext_nist_deployed_ai_monitoring_2026", "ext_nist_incident_response_2025", "scf"],
  "caveat_consolidation": {"local_caveat": "The publication scene states once that it was formalized after success and cannot enter a prospective causal denominator.", "consolidated_disposition": "Detector quality, command authority, containment, degradation, fallback, inventory, effects, operator capacity, distributed recovery, recurrence, disclosure, and decommissioning limits remain distinct.", "distinct_limitations_preserved": true},
  "bookkeeping_surface_disposition": "The commit, artifact, and 873/893-second observations remain because identity custody and effect observation are the case; exhaustive status and mutation inventories remain in evidence surfaces.",
  "semantic_diff": {"unique_claims_preserved": true, "sources_preserved": true, "proof_boundaries_preserved": true, "non_claims_preserved": true, "support_state_effect": "none", "release_effect": "none"},
  "editorial_diagnostics": {"mega_sentence_disposition": "The new projections isolate recovery meaning and operational admission from the compact formal lifecycle claim.", "hedge_disposition": "The retrospective-development boundary is consolidated while detector, effect, fallback, operator, distributed-recovery, and causal limits remain explicit.", "table_disposition": "Operational artifact and fault tables remain where failure routes are the argument; machine-status inventories stay in evidence surfaces."},
  "non_claims": ["The publication trace was recorded after success and is not a prospective campaign.", "The trace does not establish incident-control efficacy, safe degradation, or effect-complete recovery.", "The editorial revision does not move chapter-core support or release state."]
}
