{
  "schema_version":"asi_stack.p7_1c_reader_prose_quality_packet.v1","chapter_id":"human-ai-organizations-delegation-and-accountability","chapter_file":"chapters/human-ai-organizations-delegation-and-accountability.qmd","chapter_sha256":"6ee9b2644e21e4e2b869b5aa529fa894bec5dbd3ae8d14867f8f9d624954e52f","chapter_role":"load-bearing-reference","reader_spine_unit":"unit-15-labor-and-artifacts","review_state":"digest_bound_editorial_pass",
  "concrete_scene":{"heading":"Worked two-hop delegation: responsibility follows the grant","actor_or_system":"A root principal, three successive accountable owners, separate reviewers and evidence custodians, and two bounded authority handoffs","attempted_action":"Delegate one operation from owner 2 to 3 and then 4 while lowering the ceiling from 4 to 3 to 1.","observable_outcome":"The final delegate and accountable owner agree at 4, while prior owners 3 and 2 remain in residual custody and intervention, appeal, and remedy paths survive.","failed_or_tested_boundary":"The scene tests whether responsibility can move without matching authority, independent review, evidence custody, and remedy; it cannot.","residual_owner":"Current and prior owners retain handoff, contest, incident, appeal, remedy, evidence, and outcome residuals.","evidence_boundary":"The finite bridge checks organizational custody and does not establish human control, legal accountability, remedy efficacy, or good outcomes."},
  "worked_trace":{"heading":"Worked two-hop delegation: responsibility follows the grant","state_labels":["owner_2_ceiling_4","owner_3_ceiling_3","owner_4_ceiling_1","prior_owners_residualized","remedy_path_preserved"],"source_or_fixture_refs":["tests/fixtures/proof_models/human_ai_organization_responsibility_bridge.json","evidence_quality/proof_model_dossiers/human-ai-organizations-delegation-and-accountability.md"],"maximum_inference":"The finite model composes responsibility and authority handoffs; actual competence, control, accountability, welfare, resilience, and remedy remain unproven."},
  "counterexample_or_simpler_baseline":"A role matrix changes the assignee and forgets prior owners. The compositional route lowers authority, transfers control paths, and retains the residual chain.","readable_claim":"Delegation moves bounded authority and current responsibility; it must not erase prior owners, reviewers, evidence custodians, appeal paths, or remedy obligations.","normative_rule":"Every handoff must lower or preserve the authority ceiling, name the new accountable owner, keep review and evidence custody independent, transfer intervention and remedy paths, and retain prior owners in the residual chain. An incomplete handoff does not activate.",
  "formal_binding":{"claim_id":"human-ai-organizations-delegation-and-accountability.core","support_state":"argument","anchor":"versioned organizational contract binds purpose"},"claim_atom_and_source_links":["human-ai-organizations-delegation-and-accountability.core","ext_nist_ai_rmf_2023","talos"],"caveat_consolidation":{"local_caveat":"The scene states once that custody is not legal or practical accountability.","consolidated_disposition":"Competence, control, authority, accountability, welfare, remedy, resilience, support, and release remain separate.","distinct_limitations_preserved":true},"bookkeeping_surface_disposition":"Owner, ceiling, reviewer, custodian, and residual IDs remain reader-facing; exhaustive lifecycle routes stay in formal evidence.","semantic_diff":{"unique_claims_preserved":true,"sources_preserved":true,"proof_boundaries_preserved":true,"non_claims_preserved":true,"support_state_effect":"none","release_effect":"none"},"editorial_diagnostics":{"mega_sentence_disposition":"The short rule projects the organizational contract into a handoff test.","hedge_disposition":"One evidence boundary preserves legal and outcome limits.","table_disposition":"Responsibility matrices remain where role separation is the mechanism."},"non_claims":["The trace does not establish meaningful human control.","Finite delegation custody does not establish legal accountability or remedy efficacy.","The editorial revision does not move support or release state."]
}
