{"schema_version":"asi_stack.p7_1c_reader_prose_quality_packet.v1","chapter_id":"learning-compute-topology-and-adaptive-process-architecture","chapter_file":"chapters/learning-compute-topology-and-adaptive-process-architecture.qmd","chapter_sha256":"09cf19c39329198c62fb5e43b6ea495108de2ed00b84e354c0755952664948fe","chapter_role":"load-bearing-reference","reader_spine_unit":"unit-18-developmental-learning","review_state":"digest_bound_editorial_pass","concrete_scene":{"heading":"Worked trace: one bounded architecture repair","actor_or_system":"A deployed code model, two differentiated repair branches, independent evaluators, an integration planner, an archive, and a physical compiler.","attempted_action":"Repair a recurring concurrency-bug weakness without treating identical replicas, evaluator votes, or a convenient weight average as evidence of retained learning.","observable_outcome":"The branches prove complementary but interfere under weight averaging; a routed specialist survives validation, then its slow-tier placement violates the online latency budget and narrows deployment to high-risk review.","failed_or_tested_boundary":"The trace tests whether typed identity, evaluation, integration, retention, and realization receipts expose decisions hidden by a generic fork-and-merge diagram.","residual_owner":"Training, evaluation, integration, resource, rights, archive, deployment, rollback, and topology-control owners retain their separate residuals.","evidence_boundary":"The scene is a worked design trace derived from the source, not an observed learning campaign, model-quality result, compiler validation, scaling law, safety result, or support-state promotion."},"worked_trace":{"heading":"Worked trace: one bounded architecture repair","state_labels":["recurring_gap_registered","resolution_contract_frozen","branches_differentiated","evaluators_lineage_bound","weight_merge_interferes","routed_specialist_selected","latency_receipt_narrows_route"],"source_or_fixture_refs":["chapters/learning-compute-topology-and-adaptive-process-architecture.qmd","sources/source_notes/learning_compute_topology.md"],"maximum_inference":"A typed learning-process representation can make identity, evaluator correlation, integration choice, retained alternatives, and physical realization leakage inspectable; it does not establish that the proposed process improves a natural learning system."},"counterexample_or_simpler_baseline":"The simpler baselines are no branch, one competent repair lineage, fixed branching, ordinary weight averaging, and a specialist module; ABVI or adaptive rewrites must beat them after evaluation, integration, storage, rollback, and governance cost.","readable_claim":"Hardware parallelism and learning plurality are different. Count persistent adaptive histories, not devices, and name the evidence, judgement, credit, integration, and authority that connect them.","normative_rule":"Freeze a resolution contract; type every adaptive store and consequential edge; compile through a semantic firewall; return a realization receipt; and test topology changes against competent matched baselines with reversible integration and complete cost.","formal_binding":{"claim_id":"learning-compute-topology-and-adaptive-process-architecture.core","support_state":"argument","anchor":"represent the learning process as a typed, versioned, provenance-bearing, rewritable causal topology"},"claim_atom_and_source_links":["learning-compute-topology-and-adaptive-process-architecture.core","learning_compute_topology","ext_pbt_2017","ext_openai_es_2017"],"caveat_consolidation":{"local_caveat":"Each formal, executable, manual, analytical, and hypothetical contribution retains its exact evidence state where it is introduced.","consolidated_disposition":"Representation adequacy, normalization agreement, compiler correctness, natural learning benefit, topology causality, safety, transfer, and scaling remain separate unresolved burdens.","distinct_limitations_preserved":true},"bookkeeping_surface_disposition":"The reader chapter keeps the concrete mechanism, equivalence distinctions, phase questions, and experimental decisions visible; package custody, checksums, exhaustive coverage, and passage dispositions remain in the source note and paper library.","semantic_diff":{"unique_claims_preserved":true,"sources_preserved":true,"proof_boundaries_preserved":true,"non_claims_preserved":true,"support_state_effect":"none","release_effect":"none"},"editorial_diagnostics":{"mega_sentence_disposition":"Long source enumerations were converted into discriminating tables and short mechanism paragraphs with explicit comparison questions.","hedge_disposition":"Evidence boundaries appear next to the proposition, prototype, phase-study, and supplemental-hypothesis material they constrain.","table_disposition":"Tables are retained only where they prevent semantic collapse across topology layers, conformance, equivalence, propositions, control coordinates, phase studies, and experiment families."},"non_claims":["The worked repair trace is not a natural neural-training experiment.","The passing v0.1 package does not establish compiler correctness or E-level topology synthesis.","The morphology and long-horizon transformation sections do not establish a scaling law, safe self-improvement, support promotion, SOTA, AGI, or ASI."]}
