{
  "schema_version":"asi_stack.p7_1c_reader_prose_quality_packet.v1","chapter_id":"living-book-methodology","chapter_file":"chapters/living-book-methodology.qmd","chapter_sha256":"fa3caa8bf28aeefcfc890a120ce29f3fde475d005d9106052af8fab738368265","chapter_role":"implementation-case","reader_spine_unit":"unit-22-living-book-and-agenda","review_state":"digest_bound_editorial_pass",
  "concrete_scene":{"heading":"Worked structural edit: insert a chapter without renaming its neighbors","actor_or_system":"A canonical chapter manifest, one inserted chapter, stable existing IDs, derived ordinals, evidence packets, videos, and release gates","attempted_action":"Insert a chapter between positions 20 and 21 while preserving all prior identities and derivative bindings.","observable_outcome":"Display ordinals become contiguous, existing IDs remain stable, and a digest-plus-count summary cannot launder missing editorial or release gates.","failed_or_tested_boundary":"The scene tests whether reorder requires identity churn or whether a green structural summary establishes publication acceptance; neither follows.","residual_owner":"Editorial, source, evidence, render, accessibility, rights, reader, derivative, release, and public-truth owners retain separate gates.","evidence_boundary":"Repository-process checks establish deterministic authored structure, not source truth, prose quality, accessibility, availability, reader approval, or chapter truth."},
  "worked_trace":{"heading":"Worked structural edit: insert a chapter without renaming its neighbors","state_labels":["manifest_current","chapter_inserted","ordinals_derived","stable_ids_preserved","release_gates_independent"],"source_or_fixture_refs":["evidence_quality/proof_model_dossiers/living-book-methodology.md","scripts/validate_living_book_change_packets.py"],"maximum_inference":"Manifest compilation and finite change custody are coherent; editorial quality, public truth, accessibility, availability, and reader approval remain unproven."},
  "counterexample_or_simpler_baseline":"The filename-order baseline renumbers neighbors and breaks derivatives. The manifest compiler derives order while preserving stable identities.","readable_claim":"A living book stays trustworthy when edits can change order, prose, evidence, and presentation without changing chapter identity or silently promoting claims.","normative_rule":"Drive structure from one canonical manifest, keep chapter IDs stable, derive display order, bind each editorial and publication change to current digests, and record its evidence and release effects separately. A green build is necessary but never sufficient for editorial acceptance or public truth.",
  "formal_binding":{"claim_id":"living-book-methodology.core","support_state":"argument","anchor":"Evidence-Preserving Publication Transaction"},"claim_atom_and_source_links":["living-book-methodology.core","chapter_manifest","publication_operating_contract"],"caveat_consolidation":{"local_caveat":"The scene states once that deterministic publication mechanics are not scholarship or reader approval.","consolidated_disposition":"Sources, prose, evidence, tests, render, accessibility, rights, readers, derivatives, release, and truth remain distinct.","distinct_limitations_preserved":true},"bookkeeping_surface_disposition":"The insertion and identity trace stays reader-facing; exhaustive release bookkeeping stays in publication records.","semantic_diff":{"unique_claims_preserved":true,"sources_preserved":true,"proof_boundaries_preserved":true,"non_claims_preserved":true,"support_state_effect":"none","release_effect":"none"},"editorial_diagnostics":{"mega_sentence_disposition":"The reader claim separates stable identity from the complete transaction contract.","hedge_disposition":"One boundary follows the structural example.","table_disposition":"Edition and gate tables remain because they are the living-book mechanism."},"non_claims":["A green render does not establish editorial quality.","Manifest integrity does not establish public availability or chapter truth.","The editorial revision does not move support or release state."]
}
