{
  "schema_version":"asi_stack.p7_1c_reader_prose_quality_packet.v1","chapter_id":"confidential-and-verifiable-ai-computation","chapter_file":"chapters/confidential-and-verifiable-ai-computation.qmd","chapter_sha256":"8c5690b11ea5e7ea1057581c2887a4860dcdf206fc5016f04d3f8f71a6b4f07b","chapter_role":"load-bearing-reference","reader_spine_unit":"unit-03-authority-and-failure","review_state":"digest_bound_editorial_pass",
  "concrete_scene":{"heading":"Worked protected computation: the enclave is valid, the fallback leaks","actor_or_system":"A protected model service, a valid enclave attestation, an encoded-computation proof, a latency budget, an ordinary fallback worker, a consumer, and leakage channels","attempted_action":"Treat correct output and valid protected-path evidence as end-to-end confidentiality after silent unprotected fallback.","observable_outcome":"The transaction rejects because prompt and state crossed an unauthorized boundary; even protected execution retains timing, length, purpose, and side-channel residuals.","failed_or_tested_boundary":"The scene tests whether component attestation substitutes for transaction authorization, semantic correctness, or end-to-end privacy; it does not.","residual_owner":"Adversary, asset, trust-anchor, attestation, proof, verifier, freshness, leakage, fallback, authorization, performance, privacy, and cost owners retain residuals.","evidence_boundary":"The finite review checks typed evidence and fallback routes and does not establish cryptographic soundness, hardware trust, side-channel resistance, authorization, privacy, or acceptable cost."},
  "worked_trace":{"heading":"Worked protected computation: the enclave is valid, the fallback leaks","state_labels":["attestation_valid","protected_path_over_budget","silent_fallback_attempted","authorization_boundary_crossed","transaction_rejected"],"source_or_fixture_refs":["tests/fixtures/proof_models/protected_computation_dossier.json","evidence_quality/proof_model_dossiers/confidential-and-verifiable-ai-computation.md"],"maximum_inference":"Evidence types, leakage lists, scope invalidation, and fallback authorization can be separated in the finite model; cryptography, hardware, side channels, semantics, authorization, privacy, and cost remain unproven."},
  "counterexample_or_simpler_baseline":"The enclave-only baseline treats valid attestation as end-to-end protection. The compositional contract includes fallback, metadata, purpose, authorization, leakage, and disclosure.","readable_claim":"An attested enclave can prove which code ran while the overall service still leaks through inputs, outputs, metadata, fallback, or an unauthorized purpose.","normative_rule":"Compose confidentiality, integrity, proof statement, trust anchors, freshness, leakage channels, verifier policy, authorization, observable fallback, revocation, and cost at the transaction boundary. Reject any unprotected fallback unless separately authorized and disclosed; never let attestation imply semantic correctness or end-to-end privacy.",
  "formal_binding":{"claim_id":"confidential-and-verifiable-ai-computation.core","support_state":"argument","anchor":"compositional execution contract that names the adversary"},"claim_atom_and_source_links":["confidential-and-verifiable-ai-computation.core","ext_confidential_computing_consortium_2021","ext_zero_knowledge_proofs_1989"],"caveat_consolidation":{"local_caveat":"The scene states once that the finite review assumes its cryptographic and hardware fields.","consolidated_disposition":"Adversaries, assets, leakage, cryptography, attestations, hardware, verifiers, freshness, authorization, fallback, semantics, privacy, cost, support, and release remain distinct.","distinct_limitations_preserved":true},"bookkeeping_surface_disposition":"The valid enclave and leaking fallback stay reader-facing; complete trust and leakage matrices remain formal.","semantic_diff":{"unique_claims_preserved":true,"sources_preserved":true,"proof_boundaries_preserved":true,"non_claims_preserved":true,"support_state_effect":"none","release_effect":"none"},"editorial_diagnostics":{"mega_sentence_disposition":"The reader claim gives protected computation a component/end-to-end boundary.","hedge_disposition":"The cryptographic and hardware limitations follow the concrete fallback once.","table_disposition":"Primitive and guarantee tables remain because confidentiality, integrity, proof, authorization, and privacy differ."},"non_claims":["The scene does not establish cryptographic soundness or hardware trust.","Valid attestation does not establish authorization, semantic correctness, or end-to-end privacy.","The editorial revision does not move support or release state."]
}
